{
  "schema_version": "ir.v1",
  "request_id": "h618-agentboard-v1-toolchain-initial",
  "project_id": "h618-agentboard-v1-toolchain",
  "topology": "h618_agentboard_v1_toolchain",
  "components": [
    {
      "ref": "J1",
      "role": "usb_type_c_power_input",
      "value": "USB-C 5V input",
      "selected_part": {
        "part_id": "usb-c-receptacle-5v",
        "display_name": "USB-C receptacle",
        "mpn": "",
        "manufacturer": "",
        "lcsc_id": "C393939",
        "package": "USB-C receptacle",
        "mechanical_package": "USB-C receptacle"
      },
      "pins": [
        {
          "number": "1",
          "name": "",
          "net": "GND",
          "direction": "unspecified",
          "locked": false,
          "source": "netlist"
        },
        {
          "number": "2",
          "name": "",
          "net": "GND",
          "direction": "unspecified",
          "locked": false,
          "source": "netlist"
        },
        {
          "number": "3",
          "name": "",
          "net": "GND",
          "direction": "unspecified",
          "locked": false,
          "source": "netlist"
        },
        {
          "number": "4",
          "name": "",
          "net": "GND",
          "direction": "unspecified",
          "locked": false,
          "source": "netlist"
        },
        {
          "number": "A1B12",
          "name": "",
          "net": "GND",
          "direction": "unspecified",
          "locked": false,
          "source": "netlist"
        },
        {
          "number": "A4B9",
          "name": "",
          "net": "+5V_IN",
          "direction": "unspecified",
          "locked": false,
          "source": "netlist"
        },
        {
          "number": "A5",
          "name": "",
          "net": "USB_C_CC1",
          "direction": "unspecified",
          "locked": false,
          "source": "netlist"
        },
        {
          "number": "B1A12",
          "name": "",
          "net": "GND",
          "direction": "unspecified",
          "locked": false,
          "source": "netlist"
        },
        {
          "number": "B4A9",
          "name": "",
          "net": "+5V_IN",
          "direction": "unspecified",
          "locked": false,
          "source": "netlist"
        },
        {
          "number": "B5",
          "name": "",
          "net": "USB_C_CC2",
          "direction": "unspecified",
          "locked": false,
          "source": "netlist"
        }
      ],
      "assigned_sheet": "",
      "availability_status": "available",
      "notes": [
        "Use this as the 5V input path for the first board revision.",
        "Power-path protection and CC behavior are resolved against the selected USB-C power-entry scheme.",
        "USB-C input protection is part of the resolved board revision for ESD, surge, and shell-ground decisions."
      ]
    },
    {
      "ref": "F1",
      "role": "h618_usb_power_polyfuse",
      "value": "Resettable USB fuse",
      "selected_part": {
        "part_id": "C91409",
        "display_name": "500mA PTC fuse",
        "mpn": "SMD1206P050TF",
        "manufacturer": "BHFUSE",
        "lcsc_id": "C91409",
        "package": "1206",
        "mechanical_package": "1206"
      },
      "pins": [
        {
          "number": "1",
          "name": "",
          "net": "+5V_IN",
          "direction": "unspecified",
          "locked": false,
          "source": "netlist"
        },
        {
          "number": "2",
          "name": "",
          "net": "+5V_SYS",
          "direction": "unspecified",
          "locked": false,
          "source": "netlist"
        }
      ],
      "assigned_sheet": "",
      "availability_status": "available",
      "notes": []
    },
    {
      "ref": "D1",
      "role": "h618_usb_vbus_tvs",
      "value": "5V TVS clamp",
      "selected_part": {
        "part_id": "tvs-5v-unidirectional",
        "display_name": "5V VBUS TVS diode",
        "mpn": "PTVSUC3D5VB",
        "manufacturer": "Shanghai Prisemi Elec",
        "lcsc_id": "C918847",
        "package": "SOD-323",
        "mechanical_package": "SOD-323"
      },
      "pins": [
        {
          "number": "1",
          "name": "",
          "net": "+5V_IN",
          "direction": "unspecified",
          "locked": false,
          "source": "netlist"
        },
        {
          "number": "2",
          "name": "",
          "net": "GND",
          "direction": "unspecified",
          "locked": false,
          "source": "netlist"
        }
      ],
      "assigned_sheet": "",
      "availability_status": "available",
      "notes": []
    },
    {
      "ref": "U1",
      "role": "pmic_axp313a",
      "value": "AXP313A or equivalent",
      "selected_part": {
        "part_id": "axp313a-pmic",
        "display_name": "AXP313A PMIC",
        "mpn": "",
        "manufacturer": "",
        "lcsc_id": "C5365290",
        "package": "QFN-24 4x4mm P0.5",
        "mechanical_package": "QFN-24 4x4mm P0.5"
      },
      "pins": [
        {
          "number": "1",
          "name": "",
          "net": "+1V2_DDR",
          "direction": "unspecified",
          "locked": false,
          "source": "netlist"
        },
        {
          "number": "5",
          "name": "",
          "net": "H618_PMIC_I2C_SDA",
          "direction": "unspecified",
          "locked": false,
          "source": "netlist"
        },
        {
          "number": "6",
          "name": "",
          "net": "H618_PMIC_I2C_SCL",
          "direction": "unspecified",
          "locked": false,
          "source": "netlist"
        },
        {
          "number": "8",
          "name": "",
          "net": "+0V9_DDR",
          "direction": "unspecified",
          "locked": false,
          "source": "netlist"
        },
        {
          "number": "9",
          "name": "",
          "net": "GND",
          "direction": "unspecified",
          "locked": false,
          "source": "netlist"
        },
        {
          "number": "11",
          "name": "",
          "net": "H618_PMIC_INT",
          "direction": "unspecified",
          "locked": false,
          "source": "netlist"
        },
        {
          "number": "12",
          "name": "",
          "net": "+1V1_CORE",
          "direction": "unspecified",
          "locked": false,
          "source": "netlist"
        },
        {
          "number": "14",
          "name": "",
          "net": "H618_PMIC_PWRON",
          "direction": "unspecified",
          "locked": false,
          "source": "netlist"
        },
        {
          "number": "15",
          "name": "",
          "net": "+1V8",
          "direction": "unspecified",
          "locked": false,
          "source": "netlist"
        },
        {
          "number": "16",
          "name": "",
          "net": "+3V3",
          "direction": "unspecified",
          "locked": false,
          "source": "netlist"
        },
        {
          "number": "17",
          "name": "",
          "net": "+5V_SYS",
          "direction": "unspecified",
          "locked": false,
          "source": "netlist"
        }
      ],
      "assigned_sheet": "",
      "availability_status": "available",
      "notes": [
        "PMIC choice is resolved to the selected H618 board revision.",
        "Power sequencing, reset release, and enable timing are now carried through the board bring-up plan.",
        "The PMIC is expected to provide the main rails for 3V3, 1V8, 1V1_CORE, 1V2_DDR, and 0V9_DDR.",
        "Keep this block aligned with the resolved power tree for the first board revision."
      ]
    },
    {
      "ref": "U2",
      "role": "h618_soc_bga",
      "value": "Allwinner H618",
      "selected_part": {
        "part_id": "allwinner-h618-c9900058061",
        "display_name": "ALLWINNER H618",
        "mpn": "",
        "manufacturer": "",
        "lcsc_id": "C9900058061",
        "package": "BGA-284_L14.0-W12.0-P0.65-TL",
        "mechanical_package": "BGA-284_L14.0-W12.0-P0.65-TL"
      },
      "pins": [
        {
          "number": "BOOT0",
          "name": "",
          "net": "H618_FEL_BOOT",
          "direction": "unspecified",
          "locked": false,
          "source": "netlist"
        },
        {
          "number": "CKE",
          "name": "",
          "net": "H618_LPDDR4_CKE",
          "direction": "unspecified",
          "locked": false,
          "source": "netlist"
        },
        {
          "number": "DQ0",
          "name": "",
          "net": "H618_LPDDR4_DQ0",
          "direction": "unspecified",
          "locked": false,
          "source": "netlist"
        },
        {
          "number": "DQ1",
          "name": "",
          "net": "H618_LPDDR4_DQ1",
          "direction": "unspecified",
          "locked": false,
          "source": "netlist"
        },
        {
          "number": "DQ2",
          "name": "",
          "net": "H618_LPDDR4_DQ2",
          "direction": "unspecified",
          "locked": false,
          "source": "netlist"
        },
        {
          "number": "DQ3",
          "name": "",
          "net": "H618_LPDDR4_DQ3",
          "direction": "unspecified",
          "locked": false,
          "source": "netlist"
        },
        {
          "number": "GND",
          "name": "",
          "net": "GND",
          "direction": "unspecified",
          "locked": false,
          "source": "netlist"
        },
        {
          "number": "HDMI_CLK_N",
          "name": "",
          "net": "H618_HDMI",
          "direction": "unspecified",
          "locked": false,
          "source": "netlist"
        },
        {
          "number": "HDMI_CLK_P",
          "name": "",
          "net": "H618_HDMI",
          "direction": "unspecified",
          "locked": false,
          "source": "netlist"
        },
        {
          "number": "HDMI_TX0_N",
          "name": "",
          "net": "H618_HDMI",